SDOM,TYPEQU,NOMRS,CAPACITE,type,idINS,lon,lat
C4,C409,ETABLISSEMENT SUPERIEUR TECHNIQUE PRIVE ECS MARSEILLE,,Autres,r200N2252400E3945800,5.388608179,43.27748109
C4,C409,ETABLISSMENT SUPERIEUR TECHNIQUE PRIVE IEJ MARSEILLE,,Autres,r200N2252400E3945800,5.388608179,43.27748109
C4,C409,POLE NATIONAL SUPERIEUR DANSE PROVENCE COTE D'AZUR,,Autres,r200N2251000E3945400,5.384917309,43.26383326
C4,C409,ETABLISSEMENT SUPERIEUR TECHNIQUE PRIVE CAMAS ACADEMY,,Autres,r200N2252800E3945800,5.387563345,43.28062445
C4,C409,ETB.ENS.SUP.TECHNIQUE SUP DE WEB MARSEILLE,,Autres,r200N2252400E3945800,5.388608179,43.27748109
C4,C410,INSTITUT REGIONAL DU TRAVAIL SOCIAL (IRTS) PACA ET CORSE,,Autres,r200N2247800E3943800,5.366372352,43.23375153
C5,C503,ENS MARITIME MARSEILLE,,Autres,r200N2248000E3944600,5.375746801,43.23707831
C6,C610,FREEFORMA,,Autres,r200N2252400E3945400,5.383939607,43.27679782
C6,C610,EBM BUSINESS SCHOOL,,Autres,r200N2251200E3946200,5.394565026,43.26619899
C6,C610,LP,,Autres,r200N2248600E3945000,5.381019647,43.24201987
C6,C610,FORMASEQ,,Autres,r200N2252600E3945800,5.387595044,43.27789398
C6,C610,TRIPHASE FORMATIONS,,Autres,r200N2252400E3946000,5.390998719,43.27655354
C6,C610,OFORMATIO,,Autres,r200N2253000E3945800,5.388922506,43.28180765
C6,C610,INST REGIONAL TRAVAIL SOCIAL PACA CORSE,,Autres,r200N2247800E3943800,5.366372352,43.23375153
C6,C610,ASS DES PROFESSIONELS DE LA FORME,,Autres,r200N2250800E3946000,5.392425324,43.26191196
C6,C610,LYCEE POLYVALENT PERIER,,Autres,r200N2253000E3945200,5.38183183,43.28114523
C6,C610,LYCEE POLYVALENT DAUMIER HONORE,,Autres,r200N2250800E3945400,5.385895768,43.26142327
C6,C610,LYCEE PROFESSIONNEL MISTRAL FREDERIC,,Autres,r200N2250400E3946000,5.392342373,43.25862285
C6,C610,ASSOCIATION POUR LA FORMATION ET LE PERFECTIONNEMENT DES EDUCATEURS SPORTIFS,,Autres,r200N2250200E3945800,5.389512601,43.25608311
C6,C610,LPO,,Autres,r200N2248800E3946000,5.392527455,43.24437667
C6,C610,LYCEE PROFESSIONNEL LEAU (BD),,Autres,r200N2250000E3945400,5.385214882,43.25417277
C6,C610,CFPPA - SITE DE MARSEILLE,,Autres,r200N2248000E3945000,5.381812673,43.23646402
C6,C610,IFTE MARSEILLE,,Autres,r200N2252800E3945800,5.387563345,43.28062445
C6,C610,AFPA ENTREPRISES,,Autres,r200N2252400E3946000,5.390998719,43.27655354
C6,C610,FEDERATION NATIONALE DE LA COIFFURE PACA,,Autres,r200N2251400E3945200,5.382927544,43.26685043
C6,C610,MY BUSINESS SCHOOL - MY BUSINESS TRAINING - MY FASHION SCHOOL-MY BS-MY BT-MY FS,,Autres,r200N2252000E3945800,5.389031001,43.27232397
C6,C610,MY BUSINESS SCHOOL,,Autres,r200N2252000E3945800,5.389031001,43.27232397
C6,C610,MY BUSINESS SCHOOL - MY BUSINESS TRAINING,,Autres,r200N2252000E3945800,5.389031001,43.27232397
C6,C610,ALTERNANCE EXXECC,,Autres,r200N2252600E3945800,5.387206398,43.27768793
C6,C610,MASTER INSTITUTE,,Autres,r200N2252400E3945600,5.386931162,43.2773828
C6,C610,AUTOMOBILES FORMATION 13,,Autres,r200N2250400E3945800,5.389391954,43.25813803
C6,C610,INFORMATIQUE & TECHNIQUE COMMUNICATION,,Autres,r200N2253000E3945600,5.384613808,43.28148894
C6,C610,ASSOCIATION ECOLE TECHNIQUE PRIVEE HERMES,,Autres,r200N2252000E3945800,5.389031001,43.27232397
C6,C610,CFA HOTELIER REGIONAL,,Autres,r200N2248800E3946000,5.392527455,43.24437667
C6,C610,IFC,,Autres,r200N2251200E3945000,5.380055801,43.26472858
C1,C107,ECOLE MATERNELLE PUBLIQUE PARC SEVIGNE,143,Ecole élémentaire,r200N2250800E3947000,5.404377,43.26324642
C1,C107,ECOLE MATERNELLE PUBLIQUE PARC BERGER,75,Ecole élémentaire,r200N2250200E3948600,5.424386442,43.25852298
C1,C107,ECOLE MATERNELLE PUBLIQUE BAUME (LA,55,Ecole élémentaire,r200N2247600E3947200,5.40989824,43.23442076
C1,C107,ECOLE MATERNELLE PUBLIQUE LA SOUDE,112,Ecole élémentaire,r200N2248800E3946400,5.399021901,43.24510777
C1,C107,ECOLE MATERNELLE PUBLIQUE LUMINY,47,Ecole élémentaire,r200N2248600E3949600,5.437848572,43.24454046
C1,C107,ECOLE MATERNELLE PUBLIQUE CALANQUES DE SORMIOU,88,Ecole élémentaire,r200N2247000E3946600,5.401750017,43.22927103
C1,C107,ECOLE MATERNELLE PUBLIQUE MAZARGUES GRANDE BASTIDE,76,Ecole élémentaire,r200N2249800E3947000,5.405708479,43.25354091
C1,C107,ECOLE MATERNELLE PUBLIQUE PARC DROMEL,103,Ecole élémentaire,r200N2251600E3947200,5.40591546,43.27072324
C1,C107,ECOLE MATERNELLE PUBLIQUE MAZARGUES VACCARO,92,Ecole élémentaire,r200N2248400E3947400,5.41057427,43.24201359
C1,C107,ECOLE MATERNELLE PUBLIQUE ALLEE DES PINS LE CABOT,145,Ecole élémentaire,r200N2249800E3948000,5.416554872,43.25401791
C1,C107,ECOLE MATERNELLE PUBLIQUE MAZARGUES,82,Ecole élémentaire,r200N2249400E3946600,5.401249017,43.24981799
C1,C107,ECOLE MATERNELLE PUBLIQUE SQUARE MICHELET,83,Ecole élémentaire,r200N2251400E3946400,5.396427842,43.26724654
C1,C107,ECOLE MATERNELLE PUBLIQUE ROY D'ESPAGNE GRANADOS,72,Ecole élémentaire,r200N2248000E3946000,5.393928787,43.23670379
C1,C107,ECOLE MATERNELLE PUBLIQUE VALMANTE,74,Ecole élémentaire,r200N2249000E3948200,5.420549791,43.24776061
C1,C107,ECOLE MATERNELLE PUBLIQUE CHATEAU SEC,58,Ecole élémentaire,r200N2250000E3947200,5.407705698,43.25647444
C1,C107,ECOLE MATERNELLE PUBLIQUE SAINTE MARGUERITE,107,Ecole élémentaire,r200N2251200E3947200,5.40586352,43.26762357
C1,C107,ECOLE MATERNELLE PUBLIQUE PAULINE (LA,112,Ecole élémentaire,r200N2251600E3947600,5.411303088,43.27062237
C1,C107,ECOLE MATERNELLE PUBLIQUE VALLON REGNY,155,Ecole élémentaire,r200N2250600E3948600,5.423025517,43.26197302
C1,C108,ECOLE PRIMAIRE PRIVEE SAINTE MARGUERITE,223,Ecole élémentaire,r200N2251000E3947400,5.408003371,43.2656246
C1,C108,ECOLE PRIMAIRE PRIVEE SAINT JEAN BAPTISTE,228,Ecole élémentaire,r200N2249000E3947000,5.405570677,43.2462076
C1,C108,ECOLE PRIMAIRE PUBLIQUE VALMONT REDON,164,Ecole élémentaire,r200N2248600E3948600,5.425849389,43.24410847
C1,C108,ECOLE PRIMAIRE PRIVEE SAINTE TRINITE,233,Ecole élémentaire,r200N2249200E3947200,5.408243494,43.24812539
C1,C108,ECOLE PRIMAIRE PRIVEE INSTITUTION FRANCO-HEBRAIQUE,209,Ecole élémentaire,r200N2250000E3948400,5.421649483,43.25620174
C1,C108,ECOLE PRIMAIRE MAZARGUES BEAUCHENE,199,Ecole élémentaire,r200N2249400E3947000,5.406196278,43.24991495
C1,C108,ECOLE PRIMAIRE PUBLIQUE CAPELETTE CURTEL,223,Ecole élémentaire,r200N2251600E3947200,5.40591546,43.27072324
C1,C108,ECOLE PRIMAIRE PUBLIQUE ROUVIERE (LA,388,Ecole élémentaire,r200N2249400E3948600,5.42529962,43.25205265
C1,C108,ECOLE PRIMAIRE PRIVEE PASTRE GRANDE BASTIDE,329,Ecole élémentaire,r200N2250600E3948400,5.422231431,43.26273114
C1,C108,ECOLE ELEMENTAIRE PRIVEE GSBE,436,Ecole élémentaire,r200N2250200E3946600,5.400246562,43.25769854
C1,C109,ECOLE ELEMENTAIRE PUBLIQUE COIN JOLI,249,Ecole élémentaire,r200N2251000E3947000,5.403177693,43.26536587
C1,C109,ECOLE ELEMENTAIRE PUBLIQUE BAUME (LA,114,Ecole élémentaire,r200N2247600E3947200,5.410085047,43.2345703
C1,C109,ECOLE ELEMENTAIRE PUBLIQUE SOUDE,195,Ecole élémentaire,r200N2248800E3946600,5.400712947,43.24536096
C1,C109,ECOLE ELEMENTAIRE PUBLIQUE SAINTE MARGUERITE,170,Ecole élémentaire,r200N2251200E3947400,5.408382114,43.26755512
C1,C109,ECOLE ELEMENTAIRE PUBLIQUE CALANQUES DE SORMIOU,119,Ecole élémentaire,r200N2247200E3946600,5.401587698,43.23006406
C1,C109,ECOLE ELEMENTAIRE PUBLIQUE ALLEE DES PINS LE CABOT,244,Ecole élémentaire,r200N2249800E3947800,5.415805465,43.25366344
C1,C109,ECOLE ELEMENTAIRE PUBLIQUE PARC DROMEL,199,Ecole élémentaire,r200N2251600E3947200,5.406385161,43.27079332
C1,C109,ECOLE ELEMENTAIRE PUBLIQUE MAZARGUES,130,Ecole élémentaire,r200N2249400E3946600,5.401450009,43.24958592
C1,C109,ECOLE ELEMENTAIRE PUBLIQUE SQUARE MICHELET,165,Ecole élémentaire,r200N2251200E3946400,5.397620861,43.26632011
C1,C109,ECOLE ELEMENTAIRE PUBLIQUE GRANADOS ROY D'ESPAGNE,126,Ecole élémentaire,r200N2248000E3945800,5.392699044,43.23673105
C1,C109,ECOLE ELEMENTAIRE PUBLIQUE VALMANTE,115,Ecole élémentaire,r200N2249000E3948400,5.421536848,43.24807317
C1,C109,ECOLE ELEMENTAIRE PUBLIQUE CHATEAU SEC,239,Ecole élémentaire,r200N2249800E3947400,5.408617999,43.25443415
C1,C109,ECOLE ELEMENTAIRE PUBLIQUE MAZARGUES VACCARO,181,Ecole élémentaire,r200N2248400E3947400,5.41057427,43.24201359
C1,C109,ECOLE ELEMENTAIRE PUBLIQUE CABOT,178,Ecole élémentaire,r200N2250200E3948200,5.418197781,43.25776177
C1,C109,ECOLE ELEMENTAIRE PUBLIQUE PAULINE (LA,215,Ecole élémentaire,r200N2251600E3947600,5.411303088,43.27062237
C1,C109,ECOLE ELEMENTAIRE PUBLIQUE VALLON REGNY,256,Ecole élémentaire,r200N2250600E3948600,5.423025517,43.26197302
C2,C201,COLLEGE PRIVE PASTRE - GRANDE BASTIDE,400,Collège,r200N2250600E3948400,5.422231431,43.26273114
C2,C201,COLLEGE PRIVE STE TRINITE,470,Collège,r200N2249200E3947200,5.408243494,43.24812539
C2,C201,COLLEGE SYLVAIN MENU,683,Collège,r200N2250200E3947600,5.41299802,43.25889303
C2,C201,COLLEGE PRIVE GSBE,168,Collège,r200N2248000E3947200,5.407530884,43.23820121
C2,C201,COLLEGE LOUIS PASTEUR,459,Collège,r200N2251400E3947400,5.40931444,43.26837904
C2,C201,COLLEGE PRIVE FRANCO HEBRAIQUE LA SOURCE,9,Collège,r200N2251200E3947600,5.411664055,43.26777052
C2,C201,COLLEGE ROY D ESPAGNE,619,Collège,r200N2248400E3946200,5.397020065,43.24110339
C2,C201,COLLEGE GYPTIS,560,Collège,r200N2250800E3948600,5.423345081,43.26304617
C2,C201,COLLEGE GRANDE BASTIDE,446,Collège,r200N2250000E3947000,5.405230541,43.25604623
C2,C201,COLLEGE COIN JOLI SEVIGNE,341,Collège,r200N2250800E3947000,5.404377,43.26324642
C3,C301,LYCEE GENERAL PRIVE STE TRINITE,255,Lycée,r200N2249200E3947200,5.408243494,43.24812539
C3,C301,LYCEE GENERAL PRIVE GSBE,85,Lycée,r200N2248800E3948200,5.421360025,43.24509154
C3,C301,LYCEE POLYVALENT PRIVE PASTRE - GRANDE BASTIDE,469,Lycée,r200N2250600E3948400,5.422231431,43.26273114
C4,C403,CECE-CSTI MARSEILLE GROUPE EUROMED MARSEILLE,,Autres,r200N2246800E3950000,5.444042618,43.22838138
C4,C403,KEDGE BUSINESS SCHOOL KEDGE BUSINESS SCHOOL,,Autres,r200N2247200E3949200,5.434690237,43.23205975
C4,C403,ECOLE TECHNOLOGIQUE PRIVEE ECOLE PRATIQUE,,Autres,r200N2248800E3949600,5.438033346,43.2469471
C4,C409,ECOLE NATIONALE SUPERIEURE D'ARCHITECTURE DE MELLE ECOLE D'ARCHITECTURE DE MARSEILLE,,Autres,r200N2247000E3949400,5.435576202,43.22942399
C4,C409,BEAUX-ARTS DE MARSEILLE MARSEILLE,,Autres,r200N2247000E3949400,5.435576202,43.22942399
C4,C409,ETABLISSEMENT SUPERIEUR PRIVE ISRP MARSEILLE,,Autres,r200N2250600E3947600,5.411905092,43.26216594
C4,C410,INSTITUT SUPERIEUR DE REEDUCATION PSYCHOMOTRICE DE MARSEILLE,,Autres,r200N2250600E3947600,5.411905092,43.26216594
C4,C410,IFSI SUD APHM SAINTE MARGUERITE,,Autres,r200N2250600E3947600,5.411905092,43.26216594
C4,C410,FORMATION CONCEILLERE EN ECONOMIE SOCIALE ET FAMILIALE,,Autres,r200N2250600E3948400,5.422231431,43.26273114
C5,C501,FACULTE DES SC.ET DU SPORT UNIVERSITE AIX MARSEILLE,,Autres,r200N2247400E3949600,5.439378981,43.23401173
C5,C501,ANT UFR SCIENCES AMU LUMINY UNIVERSITE AIX MARSEILLE,,Autres,r200N2247400E3949600,5.439378981,43.23401173
C5,C502,IUT D'AIX-MARSEILLE (LUMINY AIX-MARSEILLE UNIVERSITE,,Autres,r200N2247400E3949600,5.439378981,43.23401173
C5,C503,ECOLE POLYTECHNIQUE UNIVERSITAIRE UNIVERSITE AIX MARSEILLE,,Autres,r200N2247400E3949600,5.439378981,43.23401173
C5,C503,INSTITUT SUPERIEUR BATIMENT TRAVAUX PUBLICS,,Autres,r200N2248800E3949600,5.438033346,43.2469471
C6,C610,ECOLE SUPERIEURE DE CONDUITE DE TRAVAUX,,Autres,r200N2248600E3946400,5.397879493,43.24291569
C6,C610,ORG GEST ENS CATHO PASTRE GRANDE BASTIDE,,Autres,r200N2250600E3948400,5.42084677,43.26220223
C6,C610,INSTITUT NATIONAL SUPERIEUR D'ENSEIGNEMENT ARTISTIQUE MARSEILLE MEDITERRANEE,,Autres,r200N2247000E3949400,5.435576202,43.22942399
C6,C610,ISRP - REGION,,Autres,r200N2250600E3947600,5.411905092,43.26216594
C6,C610,EQUIS,,Autres,r200N2248600E3946400,5.397842134,43.24201658
C6,C610,GROUPE KEDGE BUSINESS SCHOOL,,Autres,r200N2246600E3949200,5.434092515,43.22590637
C6,C610,ECOLE DE LA CONSTRUCTION DES INFRASTRUCTURES ET RESEAUX APPRENTISSAGE,,Autres,r200N2250200E3946600,5.398627144,43.25796257
C6,C610,EUROMED MARSEILLE ECOLE DE MANAGEMENT,,Autres,r200N2247200E3949200,5.434690237,43.23205975
C7,C701,RESIDENCE UNIVERSITAIRE LUMINY,,Autres,r200N2247000E3949800,5.442254241,43.22983531
C7,C701,RESIDENCE UNIVERSITAIRE CAMPUS LUMINY,,Autres,r200N2247000E3949800,5.442254241,43.22983531
C7,C701,RESIDENCE UNIVERSITAIRE LUMINY,,Autres,r200N2247000E3949800,5.442254241,43.22983531
C7,C702,RESTAURANT UNIVERSITAIRE LUMINY,,Autres,r200N2247000E3949600,5.439329342,43.23072003
C1,C107,ECOLE MATERNELLE PUBLIQUE TROIS PONTS (LES,82,Ecole élémentaire,r200N2252000E3949600,5.434888527,43.27468924
C1,C107,ECOLE MATERNELLE PUBLIQUE CHANTEPERDRIX,102,Ecole élémentaire,r200N2252200E3949200,5.431250983,43.27639957
C1,C107,ECOLE MATERNELLE PUBLIQUE CAPELETTE,118,Ecole élémentaire,r200N2252800E3947400,5.406657111,43.2816388
C1,C107,ECOLE MATERNELLE PUBLIQUE TIMONE (LA,113,Ecole élémentaire,r200N2253400E3947200,5.405142042,43.28580872
C1,C107,ECOLE MATERNELLE PUBLIQUE SAINT LOUP CENTRE,134,Ecole élémentaire,r200N2253000E3949400,5.43250051,43.28479445
C1,C107,ECOLE MATERNELLE PUBLIQUE MENPENTI,186,Ecole élémentaire,r200N2253200E3946400,5.395882932,43.28425264
C1,C107,ECOLE MATERNELLE PUBLIQUE CAPELETTE MIREILLE LAUZE,228,Ecole élémentaire,r200N2253000E3947800,5.411886407,43.28325042
C1,C107,ECOLE MATERNELLE PUBLIQUE SAINT TRONC LA ROSE,,Ecole élémentaire,r200N2251600E3948200,5.419512207,43.27061873
C1,C107,ECOLE MATERNELLE PUBLIQUE SAINT LOUP CASTEL JOLI,105,Ecole élémentaire,r200N2252600E3949200,5.429630612,43.28106281
C1,C107,ECOLE MATERNELLE PUBLIQUE PONT DE VIVAUX SACCOMAN,195,Ecole élémentaire,r200N2252000E3948000,5.415665958,43.27499324
C1,C107,ECOLE MATERNELLE PUBLIQUE SAINT THYS,54,Ecole élémentaire,r200N2252400E3950000,5.440355889,43.27996017
C1,C108,ECOLE PRIMAIRE PRIVEE COLLEL (DU,117,Ecole élémentaire,r200N2251200E3948600,5.424723257,43.26688869
C1,C108,ECOLE PRIMAIRE PUBLIQUE SAUVAGERE (LA,249,Ecole élémentaire,r200N2251800E3948000,5.41587447,43.27231693
C1,C108,ECOLE PRIMAIRE PUBLIQUE SAINT TRONC CASTEL ROC,484,Ecole élémentaire,r200N2251600E3949200,5.430857909,43.27158852
C1,C108,ECOLE PRIMAIRE PUBLIQUE CAPELETTE CAP EST,222,Ecole élémentaire,r200N2252800E3946600,5.397821106,43.28172348
C1,C108,ECOLE PRIMAIRE PUBLIQUE CHATEAU SAINT CYR,361,Ecole élémentaire,r200N2252600E3950000,5.440279042,43.28131431
C1,C108,ECOLE PRIMAIRE PRIVEE SAINTE MARIE,235,Ecole élémentaire,r200N2252800E3949400,5.432930397,43.28206007
C1,C108,ECOLE PRIMAIRE PRIVEE HAYA MOUCHKA,205,Ecole élémentaire,r200N2252400E3949000,5.428250222,43.2786171
C1,C109,ECOLE ELEMENTAIRE PUBLIQUE SAINT LOUP CASTEL JOLI,149,Ecole élémentaire,r200N2252600E3949200,5.430116221,43.2804552
C1,C109,ECOLE ELEMENTAIRE PUBLIQUE TROIS PONTS (LES,107,Ecole élémentaire,r200N2251800E3949600,5.436108295,43.27286692
C1,C109,ECOLE ELEMENTAIRE PUBLIQUE CHANTEPERDRIX,130,Ecole élémentaire,r200N2252000E3949400,5.432015996,43.27603398
C1,C109,ECOLE ELEMENTAIRE PUBLIQUE SAINT LOUP CENTRE,199,Ecole élémentaire,r200N2253000E3949400,5.43250051,43.28479445
C1,C109,ECOLE ELEMENTAIRE PUBLIQUE MENPENTI,258,Ecole élémentaire,r200N2253200E3946400,5.39641403,43.283868
C1,C109,ECOLE ELEMENTAIRE PUBLIQUE SAINT LOUP GABRIEL FAURE,98,Ecole élémentaire,r200N2252600E3949400,5.433228763,43.28147053
C1,C109,ECOLE ELEMENTAIRE PUBLIQUE CAPELETTE,204,Ecole élémentaire,r200N2252800E3947400,5.4066469,43.28187527
C1,C109,ECOLE ELEMENTAIRE PUBLIQUE TIMONE (LA,179,Ecole élémentaire,r200N2253400E3947200,5.404837075,43.28568897
C1,C109,ECOLE ELEMENTAIRE PUBLIQUE CAPELETTE MIREILLE LAUZE,334,Ecole élémentaire,r200N2253000E3947800,5.411886407,43.28325042
C1,C109,ECOLE ELEMENTAIRE PUBLIQUE SAINT TRONC LA ROSE,,Ecole élémentaire,r200N2251600E3948200,5.419512207,43.27061873
C1,C109,ECOLE ELEMENTAIRE PUBLIQUE PONT DE VIVAUX SACCOMAN,342,Ecole élémentaire,r200N2252000E3948000,5.416038411,43.2751929
C2,C201,ECOLE SECONDAIRE PRIVEE COLLEL,40,Collège,r200N2251200E3948600,5.424723257,43.26688869
C2,C201,COLLEGE PRIVE ORT LEON BRAMSON,142,Collège,r200N2252600E3947600,5.410359575,43.27904634
C2,C201,COLLEGE PONT DE VIVAUX,514,Collège,r200N2252200E3948200,5.416832832,43.27705877
C2,C201,COLLEGE BARTAVELLES (LES,575,Collège,r200N2253200E3947000,5.403328983,43.28509255
C2,C201,ECOLE SECONDAIRE PRIVEE HAYA MOUCHKA,24,Collège,r200N2252400E3949000,5.428250222,43.2786171
C2,C201,COLLEGE LOUISE MICHEL,560,Collège,r200N2252200E3947400,5.408523507,43.27667555
C3,C301,LYCEE GENERAL ET TECHNOLOGIQUE MARCEL PAGNOL,783,Lycée,r200N2252800E3949600,5.433640508,43.28325852
C3,C301,ECOLE 2D DEGRE GENERAL PRIVEE BETH-MYRIAM,63,Lycée,r200N2251000E3949000,5.428270211,43.26631574
C3,C301,LYCEE GEN.ET TECHNOL.PRIVE ORT LEON BRAMSON,160,Lycée,r200N2252600E3947600,5.410359575,43.27904634
C3,C301,LYCEE POLYVALENT JEAN PERRIN,2215,Lycée,r200N2252000E3948800,5.42576475,43.27447645
C3,C302,LP LYCEE DES METIERS JEAN BAPTISTE BROCHIER,592,Lycée,r200N2253000E3947000,5.403809029,43.28237286
C3,C302,LYCEE PROFESSIONNEL AMPERE,608,Lycée,r200N2252600E3948600,5.422875877,43.28010176
C3,C302,LYCEE PROFESSIONNEL PRIVE ORT LEON BRAMSON,72,Lycée,r200N2252600E3947600,5.410359575,43.27904634
C3,C302,ECOLE 2D DEGRE PROF.PRIVEE MESSIDORO PIGIER (LCM,,Lycée,r200N2253200E3946200,5.39275566,43.28462073
C3,C305,SECTION ENSEIGNT PROFESSIONNEL LPO JEAN PERRIN,,Autres,r200N2252000E3948800,5.42576475,43.27447645
C4,C410,GRETA MARSEILLE MEDITERRANEE LYCEE BROCHIER,,Autres,r200N2253000E3947000,5.403809029,43.28237286
C4,C410,GRETA MARSEILLE MEDITERRANÉE LYCEE MARCEL PAGNOL,,Autres,r200N2252800E3949600,5.433640508,43.28325852
C4,C410,CENTRE DE FORMATION DE LA CAPELETTE,,Autres,r200N2253000E3947600,5.410770044,43.28306384
C6,C602,GRETA-CFA MARSEILLE MEDITERRANEE GRETA-CFA - LYC JEAN PERRIN,,Autres,r200N2252000E3948800,5.42576475,43.27447645
C6,C610,SAUVEGARDE 13,,Autres,r200N2253200E3947000,5.402287056,43.28413196
C6,C610,LGT,,Autres,r200N2252800E3949600,5.433640508,43.28325852
C6,C610,LE COURS MESSIDORO,,Autres,r200N2253200E3946200,5.39233168,43.28458602
C6,C610,HOPITAL DE LA CAPELETTE,,Autres,r200N2253000E3947600,5.410929057,43.28298082
C6,C610,LYCEE PRIVE,,Autres,r200N2252600E3947600,5.410359575,43.27904634
C6,C610,ASSOCIATION SUD FORMATION,,Autres,r200N2252400E3947200,5.405933883,43.27809211
C6,C610,SIGMA FORMATION,,Autres,r200N2253200E3946200,5.39390031,43.28375354
C6,C610,GRETA-CFA MARSEILLE MEDITERRANEE,,Autres,r200N2252000E3948800,5.42576475,43.27447645
C6,C610,IMPRO DES MARRONNIERS,,Autres,r200N2252800E3949200,5.42941436,43.28258774
C6,C610,LYCEE PROFESSIONEL LEON BRAMSON,,Autres,r200N2252600E3947600,5.410359575,43.27904634
C6,C610,LPO,,Autres,r200N2252000E3948800,5.42576475,43.27447645
C7,C701,RESIDENCE UNIVERSITAIRE CANADA,,Autres,r200N2253400E3946800,5.400370714,43.28623584
C7,C701,RESIDENCE UNIVERSITAIRE SAINTE-BAUME (CROUS,,Autres,r200N2253400E3947000,5.401678158,43.28684505
C1,C107,ECOLE MATERNELLE PUBLIQUE POMME SAINTE MADELEINE,183,Ecole élémentaire,r200N2254200E3950800,5.4482923,43.29558409
C1,C107,ECOLE MATERNELLE PUBLIQUE SAINT MARCEL,106,Ecole élémentaire,r200N2253000E3952000,5.46357087,43.2861784
C1,C107,ECOLE MATERNELLE PUBLIQUE AIR BEL,185,Ecole élémentaire,r200N2253600E3949400,5.430632991,43.28988169
C1,C107,ECOLE MATERNELLE PUBLIQUE ROUGUIERE (LA,99,Ecole élémentaire,r200N2254000E3951200,5.454248684,43.29474789
C1,C107,ECOLE MATERNELLE PUBLIQUE CHATEAU SAINT JACQUES,106,Ecole élémentaire,r200N2253000E3950800,5.449627874,43.28422805
C1,C107,ECOLE MATERNELLE PUBLIQUE BUZINE,52,Ecole élémentaire,r200N2253800E3955200,5.503176996,43.29411884
C1,C107,ECOLE MATERNELLE PUBLIQUE JOUVENE VALENTINE,184,Ecole élémentaire,r200N2254600E3954400,5.491487466,43.30109587
C1,C107,ECOLE MATERNELLE PUBLIQUE CAMOINS (LES,104,Ecole élémentaire,r200N2254600E3956000,5.511448971,43.30127098
C1,C107,ECOLE MATERNELLE PUBLIQUE MILLIERE,124,Ecole élémentaire,r200N2252200E3955200,5.504169946,43.28100248
C1,C107,ECOLE MATERNELLE PUBLIQUE NEREIDES (LES,84,Ecole élémentaire,r200N2254200E3954200,5.488908879,43.29845524
C1,C107,ECOLE MATERNELLE PUBLIQUE POMME HECKEL,66,Ecole élémentaire,r200N2253400E3950200,5.441297041,43.28911903
C1,C107,ECOLE MATERNELLE PUBLIQUE CITE MICHELIS,105,Ecole élémentaire,r200N2252800E3950800,5.448872994,43.28378797
C1,C107,ECOLE MATERNELLE D APPLICATION VALBARELLE (LA)-(APPL,82,Ecole élémentaire,r200N2253000E3951200,5.454678983,43.28554521
C1,C107,ECOLE MATERNELLE PUBLIQUE BARASSE (LA,100,Ecole élémentaire,r200N2252800E3953400,5.481353944,43.28479589
C1,C107,ECOLE MATERNELLE PUBLIQUE GROGNARDE (LA,156,Ecole élémentaire,r200N2254000E3949800,5.435746313,43.2942665
C1,C108,ECOLE PRIMAIRE PUBLIQUE EOURES,254,Ecole élémentaire,r200N2254400E3956600,5.519680877,43.30091747
C1,C108,ECOLE PRIMAIRE PRIVEE LOUISE DE MARILLAC,349,Ecole élémentaire,r200N2255400E3955000,5.498134786,43.30930496
C1,C108,ECOLE PRIMAIRE PUBLIQUE TREILLE (LA,74,Ecole élémentaire,r200N2255800E3956000,5.512146995,43.31329397
C1,C108,ECOLE PRIMAIRE PUBLIQUE ACCATES LA VALENTINE,136,Ecole élémentaire,r200N2254800E3954400,5.492389495,43.30241537
C1,C108,ECOLE PRIMAIRE PUBLIQUE PARETTE MAZENODE,217,Ecole élémentaire,r200N2253200E3949200,5.430131601,43.28645359
C1,C109,ECOLE ELEMENTAIRE PUBLIQUE MILLIERE (LA,157,Ecole élémentaire,r200N2252400E3955000,5.500776805,43.28208872
C1,C109,ECOLE ELEMENTAIRE PUBLIQUE POMME SAINTE MADELEINE,332,Ecole élémentaire,r200N2254200E3951000,5.450594043,43.29573082
C1,C109,ECOLE ELEMENTAIRE PUBLIQUE CAMOINS (LES,170,Ecole élémentaire,r200N2254400E3956000,5.511840513,43.3005902
C1,C109,ECOLE ELEMENTAIRE PUBLIQUE ROUGUIERE (LA,195,Ecole élémentaire,r200N2254400E3951400,5.456825518,43.29738933
C1,C109,ECOLE ELEMENTAIRE PUBLIQUE VALENTINE,336,Ecole élémentaire,r200N2253800E3953800,5.486214216,43.2931172
C1,C109,ECOLE ELEMENTAIRE PUBLIQUE AIR BEL,273,Ecole élémentaire,r200N2253800E3949200,5.429421222,43.29060517
C1,C109,ECOLE ELEMENTAIRE PUBLIQUE POMME HECKEL,102,Ecole élémentaire,r200N2253400E3950200,5.441349976,43.288958
C1,C109,ECOLE ELEMENTAIRE PUBLIQUE CITE MICHELIS 1,173,Ecole élémentaire,r200N2252800E3950800,5.448872994,43.28378797
C1,C109,ECOLE ELEMENTAIRE PUBLIQUE CITE MICHELIS 2,194,Ecole élémentaire,r200N2252800E3950800,5.448872994,43.28378797
C1,C109,ECOLE ELEMENTAIRE PUBLIQUE SAINT MARCEL,137,Ecole élémentaire,r200N2253200E3952200,5.465221228,43.28677256
C1,C109,ECOLE ELEMENTAIRE PUBLIQUE VALBARELLE (LA,141,Ecole élémentaire,r200N2253200E3951400,5.45640414,43.28749895
C1,C109,ECOLE ELEMENTAIRE PUBLIQUE NEREIDES (LES,137,Ecole élémentaire,r200N2252800E3951800,5.461140935,43.28342427
C1,C109,ECOLE ELEMENTAIRE PUBLIQUE BARASSE (LA,149,Ecole élémentaire,r200N2252800E3953400,5.481386434,43.28421104
C1,C109,ECOLE ELEMENTAIRE PRIVEE NOTRE-DAME DE LA JEUNESSE,282,Ecole élémentaire,r200N2253200E3955000,5.499455729,43.28981147
C1,C109,ECOLE ELEMENTAIRE PUBLIQUE GROGNARDE (LA,288,Ecole élémentaire,r200N2254000E3949800,5.43570833,43.29336737
C2,C201,COLLEGE PRIVE ST EUGENE DE MAZENOD,367,Collège,r200N2255400E3955000,5.497993409,43.30904587
C2,C201,COLLEGE PRIVE NOTRE DAME DE LA JEUNESSE,393,Collège,r200N2253400E3955000,5.500515144,43.29058356
C2,C201,COLLEGE CHATEAU FORBIN,518,Collège,r200N2253000E3952200,5.46770891,43.28559978
C2,C201,COLLEGE FRANCOIS VILLON,362,Collège,r200N2253000E3951800,5.462645423,43.28530148
C2,C201,COLLEGE RUISSATEL (LE,822,Collège,r200N2254200E3954000,5.488416086,43.29772102
C3,C301,LYCEE TECHNOLOGIQUE PRIVE CHIMIE ET BIOLOGIE LA FORBINE,250,Lycée,r200N2253200E3952200,5.466460002,43.28672701
C3,C301,LYCEE POLYVALENT PRIVE MODELE ELECTRONIQUE,165,Lycée,r200N2253000E3952400,5.468450047,43.28648896
C3,C301,LYCEE GENERAL PRIVE MELIZAN,551,Lycée,r200N2254200E3954400,5.493103,43.29690685
C3,C302,LYCEE PROFESSIONNEL CAMILLE JULLIAN,297,Lycée,r200N2253000E3953000,5.477369267,43.28610142
C3,C302,LP LYCEE DES METIERS RENE CAILLIE,387,Lycée,r200N2253200E3949800,5.43784038,43.28637093
C3,C304,SECTION ENSEIGNT GEN.ET TECHNO LP RENE CAILLIE,,Autres,r200N2253200E3949800,5.43784038,43.28637093
C4,C410,IFAS CLINIQUE ST MARTIN,,Autres,r200N2254600E3955400,5.505263255,43.30193665
C5,C504,ECOLE ENSEIGNEMENT SUPERIEUR PRIVE ISEN YNCREA MEDITERRANEE,,Autres,r200N2253600E3952800,5.47355097,43.29160861
C6,C610,ECOLE DE SAUVETAGE COTIER MEDITERRANEE,,Autres,r200N2253000E3950800,5.449627874,43.28422805
C6,C610,LYCEE PROFESSIONNEL RENE CAILLIE - LYCEE DES METIERS DU BATIMENT DES TRAVAUX PUBLICS ET DE LA TOPOGRAPHIE,,Autres,r200N2253200E3949800,5.43784038,43.28637093
C6,C610,YNCREA MEDITERRANEE,,Autres,r200N2253600E3952800,5.47355097,43.29160861
C6,C610,BTP-CFA MARSEILLE,,Autres,r200N2254400E3952600,5.471636041,43.29795164
C6,C610,LA FORBINE LYCEE TECHNIQUE PRIVE DE CHIMIE ET BIOLOGIE,,Autres,r200N2253200E3952200,5.466460002,43.28672701
C6,C610,DEKRA INDUSTRIAL,,Autres,r200N2253000E3954200,5.491985785,43.28669276
C1,C107,ECOLE MATERNELLE PUBLIQUE LIERRES (LES,71,Ecole élémentaire,r200N2255600E3949400,5.430203293,43.3075716
C1,C107,ECOLE MATERNELLE PUBLIQUE BLANCARDE (LA,122,Ecole élémentaire,r200N2255000E3947800,5.41065944,43.3010057
C1,C107,ECOLE MATERNELLE PUBLIQUE SAINT JULIEN,132,Ecole élémentaire,r200N2256400E3951000,5.449223529,43.31506992
C1,C107,ECOLE MATERNELLE PUBLIQUE BEAUMONT BOMBARDIERE,96,Ecole élémentaire,r200N2256600E3950000,5.438004417,43.31733656
C1,C107,ECOLE MATERNELLE PUBLIQUE HAITI,77,Ecole élémentaire,r200N2254600E3948000,5.414489469,43.29808246
C1,C107,ECOLE MATERNELLE PUBLIQUE BASTIDE SAINT JEAN,48,Ecole élémentaire,r200N2254400E3948600,5.422319125,43.29726826
C1,C107,ECOLE MATERNELLE PUBLIQUE ROSIERE (LA,162,Ecole élémentaire,r200N2255400E3950000,5.438268039,43.30530216
C1,C107,ECOLE MATERNELLE PUBLIQUE FOURRAGERE (LA,190,Ecole élémentaire,r200N2254800E3949200,5.427772459,43.30049188
C1,C107,ECOLE MATERNELLE PUBLIQUE GRANDE BASTIDE CAZAULX,164,Ecole élémentaire,r200N2254600E3950200,5.441934748,43.29828661
C1,C107,ECOLE MATERNELLE PUBLIQUE CAILLOLS (LES,158,Ecole élémentaire,r200N2254800E3950800,5.448159777,43.30131378
