SDOM,TYPEQU,NOMRS,CAPACITE,type,idINS,lon,lat
C1,C107,ECOLE MATERNELLE PUBLIQUE CHATEAU DOUBLE,127,Ecole élémentaire,r200N2280200E3950200,5.423490613,43.53035941
C1,C107,ECOLE MATERNELLE PUBLIQUE JOSEPH D'ARBAUD,103,Ecole élémentaire,r200N2280000E3949600,5.415961021,43.52782692
C1,C107,ECOLE MATERNELLE PUBLIQUE FLORALIES (LES,78,Ecole élémentaire,r200N2278600E3951200,5.43557794,43.51594901
C1,C107,ECOLE MATERNELLE PUBLIQUE COUTHERON FONTROUSSE,75,Ecole élémentaire,r200N2287800E3952600,5.446232664,43.59908326
C1,C107,ECOLE MATERNELLE PUBLIQUE ALPHONSE DAUDET,80,Ecole élémentaire,r200N2280800E3954000,5.469306886,43.53797146
C1,C107,ECOLE MATERNELLE PUBLIQUE CUQUES (DE,78,Ecole élémentaire,r200N2279000E3952800,5.454462178,43.52036819
C1,C107,ECOLE MATERNELLE PUBLIQUE EDOUARD PEISSON,131,Ecole élémentaire,r200N2275000E3949600,5.419646061,43.481947
C1,C107,ECOLE MATERNELLE PUBLIQUE JULES PAYOT,82,Ecole élémentaire,r200N2279600E3949400,5.414410965,43.52292822
C1,C107,ECOLE MATERNELLE PUBLIQUE JACQUES PREVERT,91,Ecole élémentaire,r200N2279800E3951000,5.432928795,43.52642481
C1,C107,ECOLE MATERNELLE PUBLIQUE MARESCHALE (LA,69,Ecole élémentaire,r200N2279600E3951000,5.433298397,43.52525867
C1,C107,ECOLE MATERNELLE PUBLIQUE JEAN MAUREL,103,Ecole élémentaire,r200N2286200E3950400,5.422208219,43.58403897
C1,C107,ECOLE MATERNELLE PUBLIQUE TORSE (LA,46,Ecole élémentaire,r200N2279400E3953600,5.466502867,43.52393252
C1,C107,ECOLE MATERNELLE PUBLIQUE CAMPRA,45,Ecole élémentaire,r200N2280400E3952200,5.447426686,43.53226142
C1,C107,ECOLE MATERNELLE PUBLIQUE FELICITE (LA,97,Ecole élémentaire,r200N2278000E3950000,5.422618141,43.50967574
C1,C107,ECOLE MATERNELLE PUBLIQUE ROCHER DU DRAGON,71,Ecole élémentaire,r200N2280600E3951600,5.438513604,43.53452354
C1,C107,ECOLE MATERNELLE D APPLICATION MATERN. APPLICATION GRASSI,93,Ecole élémentaire,r200N2280600E3951800,5.443419717,43.53351302
C1,C107,ECOLE MATERNELLE PUBLIQUE CELONY,99,Ecole élémentaire,r200N2283200E3950200,5.419837133,43.55651455
C1,C107,ECOLE MATERNELLE PUBLIQUE GIONO-SCHWEITZER,125,Ecole élémentaire,r200N2279400E3950800,5.429652553,43.52191732
C1,C107,ECOLE MATERNELLE PUBLIQUE MISTRAL CORSY,83,Ecole élémentaire,r200N2280200E3950800,5.43090919,43.53033477
C1,C107,ECOLE MATERNELLE PUBLIQUE ROI RENE,74,Ecole élémentaire,r200N2279400E3952600,5.451688285,43.52432496
C1,C107,ECOLE MATERNELLE PUBLIQUE TROIS SAUTETS (LES,33,Ecole élémentaire,r200N2278600E3954000,5.469766506,43.516496
C1,C107,ECOLE MATERNELLE PUBLIQUE VAL SAINT ANDRE,75,Ecole élémentaire,r200N2278800E3953800,5.466927312,43.51927529
C1,C107,ECOLE MATERNELLE PUBLIQUE HENRI WALLON,137,Ecole élémentaire,r200N2279800E3950000,5.419542349,43.52617906
C1,C107,ECOLE MATERNELLE PUBLIQUE COLLINE DU SERRE,88,Ecole élémentaire,r200N2277400E3947600,5.392627076,43.50224045
C1,C107,ECOLE MATERNELLE PUBLIQUE PLATEAU DE L'ARBOIS,17,Ecole élémentaire,r200N2273000E3940200,5.305063934,43.45882997
C1,C107,ECOLE MATERNELLE PRIVEE PEREL,13,Ecole élémentaire,r200N2280400E3953000,5.458288958,43.53370031
C1,C107,ECOLE MATERNELLE PUBLIQUE MARCEL PAGNOL,82,Ecole élémentaire,r200N2278200E3952800,5.456131854,43.51252253
C1,C107,ECOLE MATERNELLE PUBLIQUE JULES FERRY,71,Ecole élémentaire,r200N2279200E3952400,5.449602195,43.52182962
C1,C107,ECOLE MATERNELLE D APPLICATION J.ISAAC (APPL,100,Ecole élémentaire,r200N2281400E3952800,5.453966988,43.54117198
C1,C107,ECOLE MATERNELLE PUBLIQUE DEUX ORMEAUX (LES,107,Ecole élémentaire,r200N2280400E3949600,5.416112341,43.53142411
C1,C107,ECOLE MATERNELLE PUBLIQUE GRANETTES (LES,90,Ecole élémentaire,r200N2281200E3948000,5.393838869,43.53760004
C1,C107,ECOLE MATERNELLE PUBLIQUE LAUVES,115,Ecole élémentaire,r200N2281400E3952200,5.446501938,43.54129599
C1,C107,ECOLE MATERNELLE PUBLIQUE BEAUVALLE (LA,71,Ecole élémentaire,r200N2278600E3951800,5.442899112,43.51557329
C1,C107,ECOLE MATERNELLE PUBLIQUE EUGENE BREMOND,97,Ecole élémentaire,r200N2285600E3950600,5.423167851,43.57796405
C1,C107,ECOLE MATERNELLE PUBLIQUE AUGUSTE BOYER,64,Ecole élémentaire,r200N2277800E3947600,5.391664119,43.50697785
C1,C107,ECOLE MATERNELLE D APPLICATION ARENE (APPL,78,Ecole élémentaire,r200N2279200E3950800,5.430526102,43.52120059
C1,C107,ECOLE MATERNELLE PUBLIQUE SEXTIUS,67,Ecole élémentaire,r200N2280000E3951800,5.443476459,43.52894347
C1,C108,ECOLE ELEMENTAIRE PRIVEE VAL SAINT ANDRE,115,Ecole élémentaire,r200N2278600E3953800,5.467197149,43.51645708
C1,C108,ECOLE PRIMAIRE PRIVEE SAINT FRANCOIS D'ASSISE,262,Ecole élémentaire,r200N2275400E3950200,5.42697625,43.48592025
C1,C108,ECOLE PRIMAIRE PRIVEE SAINT SER,94,Ecole élémentaire,r200N2275200E3949600,5.419868649,43.48376944
C1,C108,ECOLE PRIMAIRE PRIVEE SAINTE GENEVIEVE,248,Ecole élémentaire,r200N2280600E3950200,5.423002492,43.534015
C1,C108,ECOLE PRIMAIRE PUBLIQUE PIERRE GILLES DE GENNES,401,Ecole élémentaire,r200N2276000E3943600,5.343798912,43.48732531
C1,C108,ECOLE PRIMAIRE PRIVEE ES-EN-CIEL,64,Ecole élémentaire,r200N2284200E3949000,5.404746503,43.56449812
C1,C108,ECOLE PRIMAIRE PRIVEE NATIVITE (LA,367,Ecole élémentaire,r200N2278200E3951000,5.433922726,43.51244512
C1,C108,ECOLE PRIMAIRE PRIVEE JEANNE D ARC,199,Ecole élémentaire,r200N2279800E3952800,5.45476245,43.52819649
C1,C108,ECOLE PRIMAIRE PRIVEE SAINT JOSEPH,204,Ecole élémentaire,r200N2280200E3952600,5.452577965,43.5307621
C1,C108,ECOLE PRIMAIRE PRIVEE C.I.P.E.C,162,Ecole élémentaire,r200N2274200E3949800,5.421481557,43.47590436
C1,C108,ECOLE PRIMAIRE PRIVEE JUIVE D'AIX EN PROVENCE (EJAP,51,Ecole élémentaire,r200N2279600E3951800,5.443138359,43.52477034
C1,C108,ECOLE PRIMAIRE PUBLIQUE PLATANES (DES,132,Ecole élémentaire,r200N2280200E3952200,5.447012975,43.53073158
C1,C108,ECOLE PRIMAIRE PRIVEE SAINTE BERNADETTE,226,Ecole élémentaire,r200N2277400E3947200,5.3886474,43.50301533
C1,C108,ECOLE PRIMAIRE PUBLIQUE SIMONE VEIL,250,Ecole élémentaire,r200N2276800E3944200,5.352352033,43.49647999
C1,C108,ECOLE PRIMAIRE PRIVEE INTER. DE MEDITERRANNE (EPIM,351,Ecole élémentaire,r200N2274600E3949000,5.411093442,43.47788474
C1,C108,ECOLE PRIMAIRE PRIVEE SACRE-COEUR,284,Ecole élémentaire,r200N2279200E3954000,5.469639059,43.52313825
C1,C108,ECOLE PRIMAIRE PRIVEE SAINTE CATHERINE DE SIENNE,214,Ecole élémentaire,r200N2280200E3952600,5.451262481,43.53047587
C1,C108,ECOLE PRIMAIRE PRIVEE NOUVELLE ALLIANCE (LA,16,Ecole élémentaire,r200N2280000E3950800,5.43128873,43.52763078
C1,C109,ECOLE ELEMENTAIRE PUBLIQUE CHATEAU DOUBLE,184,Ecole élémentaire,r200N2280200E3950200,5.422254599,43.53038701
C1,C109,ECOLE ELEMENTAIRE PUBLIQUE MARESCHALE (LA,139,Ecole élémentaire,r200N2279800E3951000,5.433188191,43.52564163
C1,C109,ECOLE ELEMENTAIRE PUBLIQUE JOSEPH ROUMANILLE,112,Ecole élémentaire,r200N2277400E3947600,5.391716827,43.50290249
C1,C109,ECOLE PRIMAIRE PRIVEE PEREL,10,Ecole élémentaire,r200N2275000E3946000,5.374437831,43.48051204
C1,C109,ECOLE ELEMENTAIRE PUBLIQUE JOSEPH D'ARBAUD,170,Ecole élémentaire,r200N2280200E3949400,5.413564673,43.52968054
C1,C109,ECOLE ELEMENTAIRE PUBLIQUE FLORALIES (LES,122,Ecole élémentaire,r200N2278600E3951200,5.435531943,43.51592601
C1,C109,ECOLE ELEMENTAIRE PUBLIQUE COUTHERON FONTROUSSE,122,Ecole élémentaire,r200N2287800E3952600,5.4466158,43.59951635
C1,C109,ECOLE ELEMENTAIRE PUBLIQUE CUQUES (DE,150,Ecole élémentaire,r200N2279000E3952800,5.454462178,43.52036819
C1,C109,ECOLE ELEMENTAIRE APPLICATION ALBERIC LAURENT (APPL,142,Ecole élémentaire,r200N2280400E3952000,5.44494572,43.53273637
C1,C109,ECOLE ELEMENTAIRE PUBLIQUE JACQUES PREVERT,159,Ecole élémentaire,r200N2279800E3951000,5.432992515,43.52592272
C1,C109,ECOLE ELEMENTAIRE PUBLIQUE JEAN MAUREL,176,Ecole élémentaire,r200N2286200E3950400,5.421619717,43.58396162
C1,C109,ECOLE ELEMENTAIRE PUBLIQUE TORSE (LA,99,Ecole élémentaire,r200N2279400E3953800,5.467030831,43.52464649
C1,C109,ECOLE ELEMENTAIRE PUBLIQUE PONT DE L'ARC (DU,123,Ecole élémentaire,r200N2278200E3950000,5.421420472,43.51060262
C1,C109,ECOLE ELEMENTAIRE PUBLIQUE JEAN JAURES 2,125,Ecole élémentaire,r200N2280600E3952000,5.444655788,43.53348517
C1,C109,ECOLE ELEMENTAIRE PUBLIQUE CELONY,189,Ecole élémentaire,r200N2283200E3950200,5.420088681,43.55699701
C1,C109,ECOLE ELEMENTAIRE D'APPLICATION F.MISTRAL(APPL,205,Ecole élémentaire,r200N2280600E3951000,5.432629056,43.53434077
C1,C109,ECOLE ELEMENTAIRE D'APPLICATION A.DAUDET (APPL,107,Ecole élémentaire,r200N2280600E3953400,5.46279599,43.53581303
C1,C109,ECOLE ELEMENTAIRE PUBLIQUE GRANETTES (LES,130,Ecole élémentaire,r200N2281200E3948000,5.394053445,43.5373988
C1,C109,ECOLE ELEMENTAIRE PUBLIQUE VAL SAINT ANDRE,180,Ecole élémentaire,r200N2278800E3953600,5.466849503,43.51964387
C1,C109,ECOLE ELEMENTAIRE PUBLIQUE MARIE MAURON,109,Ecole élémentaire,r200N2279600E3952400,5.450752371,43.52619322
C1,C109,ECOLE ELEMENTAIRE PUBLIQUE GIONO-SCHWEITZER,192,Ecole élémentaire,r200N2279200E3950800,5.431425968,43.52148602
C1,C109,ECOLE ELEMENTAIRE PUBLIQUE JULES PAYOT,149,Ecole élémentaire,r200N2279600E3949400,5.413525335,43.5232538
C1,C109,ECOLE ELEMENTAIRE PUBLIQUE FENOUILLERES,118,Ecole élémentaire,r200N2278400E3951800,5.443793763,43.5139543
C1,C109,ECOLE ELEMENTAIRE PUBLIQUE HENRI WALLON,170,Ecole élémentaire,r200N2280000E3949800,5.418395079,43.52687255
C1,C109,ECOLE ELEMENTAIRE PUBLIQUE MARCEL PAGNOL,130,Ecole élémentaire,r200N2278200E3952800,5.457405934,43.51339381
C1,C109,ECOLE ELEMENTAIRE PUBLIQUE JULES FERRY,128,Ecole élémentaire,r200N2279200E3952400,5.449602195,43.52182962
C1,C109,ECOLE ELEMENTAIRE PUBLIQUE JULES ISAAC,162,Ecole élémentaire,r200N2281400E3952800,5.453640997,43.54168624
C1,C109,ECOLE ELEMENTAIRE PUBLIQUE DEUX ORMEAUX (LES,170,Ecole élémentaire,r200N2280400E3949600,5.414838488,43.53055233
C1,C109,ECOLE ELEMENTAIRE PUBLIQUE PAUL ARENE,138,Ecole élémentaire,r200N2279400E3950600,5.429366354,43.52302685
C1,C109,ECOLE ELEMENTAIRE PUBLIQUE LAUVES,121,Ecole élémentaire,r200N2281400E3952200,5.447185494,43.54085759
C1,C109,ECOLE ELEMENTAIRE PUBLIQUE AUGUSTE BOYER,139,Ecole élémentaire,r200N2277800E3947600,5.391582191,43.50676543
C1,C109,ECOLE ELEM.SPECIALISEE PRIVEE DE L'APAR - ST JOSEPH (OSEC,4,Ecole élémentaire,r200N2280200E3952600,5.452577965,43.5307621
C1,C109,ECOLE ELEMENTAIRE PUBLIQUE SALLIER,172,Ecole élémentaire,r200N2279400E3952600,5.452195539,43.52444222
C1,C109,ECOLE ELEMENTAIRE PUBLIQUE EDOUARD PEISSON,236,Ecole élémentaire,r200N2275000E3949600,5.419646061,43.481947
C1,C109,ECOLE ELEMENTAIRE D'APPLICATION SEXTIUS (APPL,120,Ecole élémentaire,r200N2280000E3951800,5.443476459,43.52894347
C1,C109,ECOLE ELEMENTAIRE PUBLIQUE EUGENE BREMOND,196,Ecole élémentaire,r200N2285600E3950600,5.423233473,43.57845075
C2,C201,COLLEGE PRIVEE LA NOUVELLE ALLIANCE,3,Collège,r200N2280200E3951000,5.433340584,43.52923879
C2,C201,COLLEGE ROCHER DU DRAGON,609,Collège,r200N2280400E3951800,5.442145403,43.53264156
C2,C201,COLLEGE JAS DE BOUFFAN,522,Collège,r200N2279600E3950200,5.423225012,43.52406435
C2,C201,COLLEGE ARC DE MEYRAN,792,Collège,r200N2278600E3953200,5.461266935,43.51690685
C2,C201,COLLEGE NINA SIMONE,572,Collège,r200N2281200E3952600,5.451905123,43.53919692
C2,C201,COLLEGE PRIVE SACRE COEUR (LE,1009,Collège,r200N2280200E3953000,5.457157466,43.53175388
C2,C201,COLLEGE PRIVE ST JOSEPH,247,Collège,r200N2280200E3952600,5.452577965,43.5307621
C2,C201,COLLEGE PRIVE CHESNERAIE (DE LA,449,Collège,r200N2274400E3948800,5.410064469,43.47575106
C2,C201,COLLEGE CHATEAU DOUBLE,555,Collège,r200N2280400E3950000,5.41959503,43.53157325
C2,C201,COLLEGE MIGNET,784,Collège,r200N2279600E3952200,5.447909068,43.5249927
C2,C201,COLLEGE PRIVE NATIVITE (LA,717,Collège,r200N2278200E3951000,5.433922726,43.51244512
C2,C201,COLLEGE PRIVE STE CATHERINE DE SIENNE,247,Collège,r200N2280200E3952600,5.451262481,43.53047587
C2,C201,COLLEGE CAMPRA,429,Collège,r200N2280400E3952400,5.449488359,43.532121
C2,C201,COLLEGE SOPHIE GERMAIN,645,Collège,r200N2275000E3949000,5.411043677,43.48134558
C2,C201,ECOLE SECONDAIRE PRIVEE ES EN CIEL,48,Collège,r200N2284200E3949000,5.404746503,43.56449812
C2,C201,COLLEGE PRIVE LA NATIVITE STE VICTOIRE,372,Collège,r200N2275600E3943800,5.347613717,43.48410723
C2,C201,CLG PR SAINT DOMINIQUE SAVIO CLG PR SAINT DOMINIQUE SAVIO,,Collège,r200N2277400E3947200,5.388150258,43.50246695
C2,C201,ECOLE PRHC VAL SAINT ANDRE CLG PR HC VAL SAINT ANDRE,89,Collège,r200N2278600E3953800,5.467197149,43.51645708
C3,C301,LYCEE POLYVALENT EMILE ZOLA,2051,Lycée,r200N2278000E3951800,5.444934734,43.51097523
C3,C301,LYCEE DES METIERS PRIVE CELONY,574,Lycée,r200N2280600E3951400,5.436518602,43.53452309
C3,C301,LYCEE GENERAL ET TECHNOLOGIQUE PAUL CEZANNE,1963,Lycée,r200N2280600E3953200,5.459194927,43.53405956
C3,C301,LYCEE POLYVALENT PRIVE LYCEE DES METIERS ST ELOI,613,Lycée,r200N2280600E3952400,5.450772213,43.53393553
C3,C301,ECOLE 2ND DEGRE GENERAL PRIVEE VAL SAINT ANDRE,7,Lycée,r200N2278600E3953800,5.467197149,43.51645708
C3,C301,LYCEE POLYVALENT VAUVENARGUES,1990,Lycée,r200N2280000E3952800,5.455786656,43.52861826
C3,C301,LYCEE MILITAIRE NATIONAL POILUS (BD DES,788,Lycée,r200N2279800E3953200,5.459213598,43.526937
C3,C301,LYCEE POLYVALENT PRIVE STE MARIE,323,Lycée,r200N2280400E3952000,5.446104356,43.53168678
C3,C301,LYCEE GENERAL ET TECHNOLOGIQUE GEORGES DUBY,1550,Lycée,r200N2274800E3949000,5.412411642,43.47992484
C3,C301,LYCEE GENERAL PRIVE NATIVITE (LA,1004,Lycée,r200N2278200E3951000,5.433922726,43.51244512
C3,C301,LYCEE GEN.ET TECHNOL.PRIVE SACRE COEUR (LE,996,Lycée,r200N2280000E3952600,5.453410046,43.52835103
C3,C301,LYCEE GENERAL PRIVE STE CATHERINE DE SIENNE,206,Lycée,r200N2280200E3952600,5.451262481,43.53047587
C3,C301,ECOLE 2D DEGRE GENERAL PRIVEE I.B.S. OF PROVENCE,585,Lycée,r200N2274200E3949800,5.421481557,43.47590436
C3,C302,LP LYCEE DES METIERS GAMBETTA,460,Lycée,r200N2279000E3953000,5.458418806,43.52002772
C3,C302,ECOLE TECHNIQUE PRIVEE SUSINI ESTHETIQUE,,Lycée,r200N2278400E3950800,5.431688772,43.51459452
C3,C302,LYCEE PROFESSIONNEL PRIVE CLOVIS HUGUES,173,Lycée,r200N2279600E3952600,5.452086001,43.52599115
C3,C302,ECOLE 2D DEGRE PROF.PRIVEE ACADEMIE D'ART DENTAIRE,4,Lycée,r200N2278200E3951200,5.436687434,43.51292258
C3,C304,SECTION GEN ET TECHNOL.PRIVEE CLOVIS HUGUES,,Autres,r200N2279600E3952600,5.452086001,43.52599115
C3,C305,SECTION ENSEIGNT PROFESSIONNEL EMILE ZOLA,,Autres,r200N2278000E3952000,5.447405905,43.5109195
C3,C305,SECTION ENSEIGNT PROFESSIONNEL VAUVENARGUES,,Autres,r200N2280000E3952800,5.455786656,43.52861826
C4,C401,ECOLE TECHNIQUE PRIVEE ESUPCOM,,Autres,r200N2278400E3950600,5.429178939,43.51430421
C4,C401,LYCEE TECHNOLOGIQUE PRIVE CELONY,,Autres,r200N2280600E3951400,5.436518602,43.53452309
C4,C401,LYCEE TECHNOLOGIQUE ESDAC (GROUPE IPSAA,,Autres,r200N2280000E3951800,5.442769788,43.52789325
C4,C403,ECOLE TECHNIQUE PRIVEE MERKURE BUSINESS SCHOOL,,Autres,r200N2278600E3950800,5.430440202,43.51485528
C4,C403,ESCAET ESCAET,,Autres,r200N2280400E3952000,5.444262125,43.53255275
C4,C403,ECOLE SUPERIEURE ESARC EVOLUTION,,Autres,r200N2278600E3950800,5.430440202,43.51485528
C4,C403,ECOLE SUPERIEURE TECHNIQUE PRI ESG,,Autres,r200N2278600E3950800,5.430440202,43.51485528
C4,C403,ECOLE SUPERIEURE DE SCIENCES COMMERCIALE ANTENNE D'AIX -MARSEILLE,,Autres,r200N2280000E3950800,5.429108015,43.52844601
C4,C403,ENSEIGNEMENT SUPERIEUR EURIDIS AIX,,Autres,r200N2280600E3952200,5.446062683,43.53509472
C4,C409,ECOLE 2D DEGRE PROF.PRIVEE COURS DIDEROT EDNH - EGPN,,Autres,r200N2278600E3950800,5.432208335,43.51474562
C4,C409,ECOLE DE FORMATION ARTISTIQUE ECOLE DE COMMUNICAT. VISUELLE,,Autres,r200N2278400E3951600,5.442279098,43.51450042
C4,C409,ECOLE SUPERIEUR D'ART ECOLE SUPERIEUR D'ART,,Autres,r200N2280200E3951600,5.44130499,43.53009
C4,C409,CENTRE DE FORMATION DANSE CAFE DANSE,,Autres,r200N2279800E3951600,5.441479498,43.52711135
C4,C409,ECOLE SUPERIEURE D'INFOGRAPHIE BRASSART,,Autres,r200N2278600E3951800,5.444122192,43.51615909
C4,C409,ETABLISSEMENT SUP TECHNIQUE PR AIX Y-NOV CAMPUS,,Autres,r200N2279400E3951000,5.432754318,43.52367527
C4,C409,ECOLE NATIONALE ENTE,,Autres,r200N2276400E3946200,5.375395074,43.49332378
C4,C409,INSTITUT DE FORMATION EURONATURE PROVENCE,,Autres,r200N2284400E3954800,5.477186337,43.57055473
C4,C409,ETAB SUPERIEUR TECH PRIVE ECOLE JAELYS,,Autres,r200N2280400E3948800,5.406186305,43.53074457
C4,C409,ECOLE ENSEIGNEMENT SUPERIEUR PRIVEE CAMPUS EDUCTIVE AIX EN PROVENCE - MAESTRIS,,Autres,r200N2278400E3950600,5.429178939,43.51430421
C4,C409,DIGITAL CAMPUS DIGITAL CAMPUS AIX,,Autres,r200N2278600E3950800,5.430440202,43.51485528
C4,C409,INSTITUT NATIONAL DES FORMATIONS NOTARIALES INFN,,Autres,r200N2279800E3951200,5.435229703,43.52597028
C4,C409,ECOLE ENSEIGNEMENT SUPERIEUR PRIVE ITM GRADUATES SCHOOL,,Autres,r200N2276200E3943200,5.338671829,43.48971307
C4,C409,ECOLE ENSEIGNEMENT SUPERIEUR TECHNIQUE INGENIERIE ET DEVELOPPEMENT,,Autres,r200N2279600E3949200,5.411899245,43.52319131
C4,C409,ECOLE SUPERIEURE TECHNIQUE PRIVEE ECOLE SUPERIEURE ITECOM,,Autres,r200N2280200E3953000,5.457915535,43.53054886
C4,C409,CRR DARIUS MILHAUD CONVERSATOIRE A RAYONNEMENT REGIONAL,,Autres,r200N2279600E3951600,5.439436715,43.52567404
C4,C409,ECOLE FRANCAISE DES ATTACHES DE PRESSE ECOLE FRANCAISE DES ATTACHES DE PRESSE,,Autres,r200N2278600E3951800,5.444122192,43.51615909
C4,C410,INSTITUT DE FORMATION DU GCSPA AIX EN PROVENCE,,Autres,r200N2279400E3951600,5.43950991,43.52301381
C4,C410,GRETA CFA PROVENCE LYCEE EMILE ZOLA,,Autres,r200N2278000E3952000,5.44617032,43.51094737
C4,C410,IRFSS PACA CORSE SITE AIX EN PROVENCE,,Autres,r200N2280200E3953000,5.456922002,43.53120102
C5,C501,ANT UFR SCIENCES AMU UNIVERSITE AIX MARSEILLE,,Autres,r200N2279000E3951600,5.440540498,43.51921192
C5,C501,UFR DROIT SCIENCE POLITIQUE UNIVERSITE AIX MARSEILLE,,Autres,r200N2278800E3952000,5.446922959,43.51871662
C5,C501,UFR MANAGT PU GOUV TERRITORIAL UNIVERSITE AIX MARSEILLE,,Autres,r200N2280200E3952200,5.447024392,43.53122892
C5,C501,UFR ECONOMIE GESTION AIX MARSEILLE UNIVERSITE,,Autres,r200N2278800E3952200,5.449049666,43.51892346
C5,C501,UFR ARTS LETTRES LANGUES SC HU UNIVERSITE AIX MARSEILLE,,Autres,r200N2278800E3952200,5.44804879,43.51779288
C5,C501,ANT EC JOURNALISME COM AMU,,Autres,r200N2280400E3952600,5.451277899,43.53304303
C5,C501,SUFLE AIX MARSEILLE UNIVERSITE,,Autres,r200N2278800E3952200,5.44804879,43.51779288
C5,C502,IUT AIX-MARSEILLE UNIVERSITE AIX MARSEILLE,,Autres,r200N2278200E3952200,5.449953767,43.51266225
C5,C502,ANTENNE INSPE AIX AMU INSPE ACADEMIE AIX MARSEILLE,,Autres,r200N2280400E3952600,5.451277899,43.53304303
C5,C503,ENS ARTS ET METIERS CER AIX ENS ARTS ET METIERS PARIS,,Autres,r200N2280200E3952800,5.456009825,43.53072992
C5,C503,CESI ECOLE ING AIX-EN-PROVENCE CESI PARIS,,Autres,r200N2275000E3947000,5.386439797,43.48124013
C5,C503,ESAIP AIX EN PROVENCE ANGEVINE D'INFORMATIQUE ET DE PRODUCTIQUE,,Autres,r200N2280000E3950800,5.429108015,43.52844601
C5,C504,FACULTE JEAN CALVIN,,Autres,r200N2278600E3952400,5.451127064,43.51711045
C5,C504,INSTIT.AMERICAN UNIVERSITIES,,Autres,r200N2280400E3952200,5.446635342,43.53171226
C5,C504,INSTITUTE FOR AMERICAN UNIVERSITIES AMERICAN COLLEGE OF THE MEDITERRANEAN,,Autres,r200N2280400E3952200,5.446635342,43.53171226
C5,C509,CTRE FORM MUSICIEN INTERVENANT UNIVERSITE AIX MARSEILLE,,Autres,r200N2278800E3952200,5.44804879,43.51779288
C5,C509,INST ADM ENTREPRISES AMU UNIVERSITE AIX MARSEILLE,,Autres,r200N2286000E3950400,5.421982141,43.58260238
C5,C509,CENTRE ENSEIGNEMENT AIX CENTRE CNAM REGION PACA,,Autres,r200N2280200E3952800,5.456009825,43.53072992
C5,C509,INST ETUDES ET CULTURES JUIVES UNIVERSITE AIX-MARSEILLE,,Autres,r200N2278600E3951800,5.443890415,43.51549947
C5,C509,MAISON MED SC DE L HOMME AMU UNIVERSITE AIX MARSEILLE,,Autres,r200N2280200E3949800,5.418519974,43.52882505
C5,C509,SCIENCES PO AIX INSTITUT D'ETUDES POLITIQUES D'AIX EN PROVENCE,,Autres,r200N2280200E3952200,5.446672848,43.53148034
C5,C509,CPAG MARSEILLE INSTITUT D ETUDES POLITIQUES,,Autres,r200N2280200E3952200,5.446672848,43.53148034
C5,C509,INST REGIONAL DU TRAVAIL AMU UNIVERSITE AIX-MARSEILLE,,Autres,r200N2279200E3953000,5.45750716,43.52284397
C5,C509,CENTRE ENSEIGNEMENT AIX MILLES CNAM PACA,,Autres,r200N2275800E3946200,5.377363519,43.48868022
C6,C602,GRETA-CFA PROVENCE GRETA-CFA - LGT VAUVENARGUES,,Autres,r200N2280000E3952800,5.455786656,43.52861826
C6,C604,CREPS CREPS PROVENCE-ALPES-COTE-D'AZUR,,Autres,r200N2277600E3951800,5.444777098,43.50792768
C6,C610,PIGIER,,Autres,r200N2279600E3951600,5.440831064,43.52504012
C6,C610,ECOLE DE SECRETARIAT MEDICO-SOCIAL,,Autres,r200N2280200E3953000,5.456922002,43.53120102
C6,C610,SUP'TERTIAIRE AIX,,Autres,r200N2277800E3950000,5.42314786,43.50772638
C6,C610,INSTITUT DE FORMATIONS SANITAIRES ET SOCIALES,,Autres,r200N2275400E3946400,5.378669086,43.4848825
C6,C610,DIRECTION REGIONALE SUD EST,,Autres,r200N2280200E3953000,5.456922002,43.53120102
C6,C610,FEDERATION NATIONALE DE LA COIFFURE PACA,,Autres,r200N2279400E3951600,5.440923826,43.52332802
C6,C610,MON CENTRE REFERENCE - FRANCE,,Autres,r200N2275600E3946400,5.379091036,43.48577649
C6,C610,COURS DIDEROT,,Autres,r200N2278600E3950800,5.432208335,43.51474562
C6,C610,KAALI FORMATION,,Autres,r200N2279800E3949400,5.413476838,43.52492589
C6,C610,ITECOM,,Autres,r200N2280200E3953000,5.457915535,43.53054886
C6,C610,LYCEE GENERAL ET TECHNO P CEZANNE,,Autres,r200N2280600E3954800,5.47938177,43.53539767
C6,C610,LGT GEORGES DUBY,,Autres,r200N2274800E3949000,5.412411642,43.47992484
C6,C610,M2I SCRIBTEL,,Autres,r200N2277000E3943800,5.345820951,43.49661401
C6,C610,INSTITUT NATIONAL DES FORMATIONS NOTARIALES,,Autres,r200N2279800E3951200,5.435229703,43.52597028
C6,C610,LYCEE POLYVALENT VAUVENARGUES,,Autres,r200N2280000E3952800,5.455786656,43.52861826
C6,C610,LYCEE DES METIERS EMILE ZOLA,,Autres,r200N2278000E3951800,5.444934734,43.51097523
C6,C610,ALTERNANCE AZUR,,Autres,r200N2276000E3946400,5.37971412,43.48902298
C6,C610,ERUDIS FORMATION,,Autres,r200N2274800E3946000,5.373657566,43.47888844
C6,C610,HOPPS GROUP,,Autres,r200N2274600E3945600,5.369944582,43.47688218
C6,C610,CAMPUS ACADEMY AIX,,Autres,r200N2274400E3946200,5.378101112,43.47592037
C6,C610,INSTITUT NATIONAL DE L'ENSEIGNEMENT A DISTANCE,,Autres,r200N2278400E3950600,5.429178939,43.51430421
C6,C610,CER D'AIX EN PROVENCE,,Autres,r200N2280200E3952800,5.456009825,43.53072992
C6,C610,ECOLE BOULANGERIE NOE,,Autres,r200N2277800E3948800,5.406089837,43.50733602
C6,C610,LTP SACRE COEUR,,Autres,r200N2280000E3952600,5.453410046,43.52835103
C6,C610,INSTITUT D'ETUDES POLITIQUES D'AIX-EN-PROVENCE,,Autres,r200N2280200E3952200,5.446672848,43.53148034
C6,C610,GROUPEMENT DE COOPERATION SANITAIRE DU PAYS D'AIX,,Autres,r200N2279400E3951600,5.43950991,43.52301381
C6,C610,LIGUE PROVENCE ALPES COTE D'AZUR HANDBALL,,Autres,r200N2275000E3947200,5.389064014,43.48150402
C6,C610,PREPA SPORTS,,Autres,r200N2276200E3944200,5.352537735,43.48950905
C6,C610,CENTRE DE RESSOURCES D'EXPERTISE ET DE PERFORMANCE SPORTIVE,,Autres,r200N2277600E3951800,5.444777098,43.50792768
C6,C610,ECOLE NATIONALE DES TECHNICIENS DE L'EQUIPEMENT,,Autres,r200N2276400E3946400,5.378665068,43.49354652
C6,C610,CAVALIERS CLUB HIPPIQUE AIX-MARSEIILLE,,Autres,r200N2278600E3951200,5.435240596,43.51569401
C6,C610,AEP SAINT ELOI,,Autres,r200N2280600E3952400,5.450772213,43.53393553
C6,C610,OGEC SAINTE MARIE,,Autres,r200N2280400E3952000,5.446104356,43.53168678
C6,C610,IFTE AIX,,Autres,r200N2278200E3951400,5.43879496,43.5120136
C6,C610,INSTITUT DE FORMATION A L'ENVIRONNEMENT ET AU DEVELOPPEMENT DURABLE,,Autres,r200N2276400E3942600,5.331579032,43.49096889
C6,C610,COURS COMMERCIAUX CLOVIS HUGUES,,Autres,r200N2279600E3952600,5.453414393,43.52606635
C6,C610,IUT AIX MARSEILLE,,Autres,r200N2278200E3952400,5.452463395,43.51350568
C6,C610,CENTRE ETUDES RECHERCHES TOURISTIQUES,,Autres,r200N2280400E3952000,5.444262125,43.53255275
C6,C610,CESI,,Autres,r200N2275000E3947000,5.386439797,43.48124013
C6,C610,CONSERVATOIRE NATIONAL DES ARTS ET METIERS DE PROVENCE ALPES COTE D4AZUR,,Autres,r200N2280200E3952800,5.456009825,43.53072992
C6,C610,LE PIED A L ETRIER,,Autres,r200N2280600E3951400,5.436518602,43.53452309
C6,C610,EURIDIS MANAGEMENT AIX,,Autres,r200N2280600E3952200,5.446062683,43.53509472
C6,C610,COIFFURE BEAUTE MEDITERRANEE,,Autres,r200N2275400E3946600,5.381698076,43.48354848
C6,C610,CENTRE FP3A,,Autres,r200N2276400E3945600,5.369634434,43.49351977
C6,C610,ENERGYZON,,Autres,r200N2275800E3946600,5.380393027,43.48759195
C6,C610,CODEV,,Autres,r200N2278600E3951000,5.432868484,43.51495693
C6,C610,YNOV-LIM'ART,,Autres,r200N2279400E3951000,5.432754318,43.52367527
C6,C610,SOCIETE INSTITUT TECHNIQUE ET PROFESSIONNEL AIXOIS,,Autres,r200N2279600E3949400,5.412332877,43.52299237
C6,C610,GRETA-CFA PROVENCE,,Autres,r200N2280000E3952800,5.455786656,43.52861826
C6,C610,BTP-CFA AIX LES MILLES,,Autres,r200N2276400E3946000,5.373871222,43.4934216
C6,C610,FOYER SOCIO EDUCATIF SAINTE VICTOIRE,,Autres,r200N2280000E3949800,5.418412997,43.52773295
C6,C610,ACADEMIE D'ART DENTAIRE,,Autres,r200N2278200E3951200,5.436687434,43.51292258
C6,C610,MAESTRIS EDUCTIVE GROUPESUPCOM,,Autres,r200N2278400E3950600,5.429178939,43.51430421
C6,C610,LTP CLOVIS HUGUES,,Autres,r200N2279600E3952600,5.452797387,43.52607355
C6,C610,SUSINI ESTHETIQUE,,Autres,r200N2278400E3950800,5.431688772,43.51459452
C6,C610,LYCEE PROFESSIONNEL GAMBETTA,,Autres,r200N2279000E3953000,5.458418806,43.52002772
C6,C610,ENVOLL CONSEIL ET FORMATION,,Autres,r200N2274800E3947600,5.395296456,43.47934955
C6,C610,VICTORIA,,Autres,r200N2278200E3953800,5.468836071,43.51423584
C6,C610,AVENIR SERVICES FORMATION,,Autres,r200N2275600E3946400,5.378470213,43.48580029
C6,C610,ESGCV,,Autres,r200N2278600E3950800,5.430440202,43.51485528
C6,C610,GIP FCIP DE L'ACADEMIE D'AIX MARSEILLE,,Autres,r200N2276600E3944000,5.349550898,43.49383
C6,C610,LYCEE TECHNOLOGIQUE CELONY,,Autres,r200N2280600E3951400,5.436518602,43.53452309
C6,C610,MERKURE FORMATION,,Autres,r200N2278600E3951000,5.434428054,43.51583602
